"GO_ID","Term","p.value","p.adj","z.score","set.size","set.mean","set.sd","num.overlap","Genes","module","tissue","fraction_overlap"
"GO:0048546","digestive tract morphogenesis",2.12052138071073e-07,2.40273007192472e-05,5.18844959728704,54,0.0740740740740741,0.264350528572715,4,"Hoxd13, Smad2, Stra6, Ahi1","red","islet",0.0740740740740741
"GO:0021872","forebrain generation of neurons",3.9739964408092e-07,4.49170069178311e-05,5.07019915044424,56,0.0714285714285714,0.259870097418821,4,"Fgf8, Gnaq, Bcl11b, Dclk2","red","islet",0.0714285714285714
"GO:0060688","regulation of morphogenesis of a branching structure",7.13378472516624e-07,7.98387946514305e-05,4.95768569431277,58,0.0689655172413793,0.255608593705383,4,"Esr1, Hoxd13, Snai2, Tacstd2","red","islet",0.0689655172413793
"GO:0003170","heart valve development",9.41776594931554e-07,0.00010514197034101,4.90342969493699,59,0.0677966101694915,0.253554508841448,4,"Smad2, Slit2, Stra6, Tbx20","red","islet",0.0677966101694915
"GO:0046324","regulation of glucose import",2.05414329701448e-06,0.00022876828161127,4.74802334620429,62,0.0645161290322581,0.247675603670653,4,"Esr1, Fgf15, Irs1, Ahi1","red","islet",0.0645161290322581
"GO:1905330","regulation of morphogenesis of an epithelium",2.62060837252776e-06,0.000290434820848271,4.69851430495176,63,0.0634920634920635,0.245804529802605,4,"Esr1, Hoxd13, Snai2, Tacstd2","red","islet",0.0634920634920635
"GO:1904659","glucose transmembrane transport",5.86449316686277e-06,0.000581977480938125,4.53121674238438,98,0.0510204081632653,0.221170689301311,5,"Esr1, Fgf15, Irs1, Slc2a3, Ahi1","red","islet",0.0510204081632653
"GO:0008645","hexose transmembrane transport",6.82829392761874e-06,0.000676149540006595,4.49897172026533,99,0.0505050505050505,0.220099113746947,5,"Esr1, Fgf15, Irs1, Slc2a3, Ahi1","red","islet",0.0505050505050505
"GO:0048844","artery morphogenesis",3.47930421289444e-05,0.00305360899609522,4.13958779995083,76,0.0526315789473684,0.224780594779607,4,"Comp, Fgf8, Hpgd, Stra6","red","islet",0.0526315789473684
"GO:0010827","regulation of glucose transmembrane transport",5.60332898078553e-05,0.00488014598613348,4.02892164142813,79,0.0506329113924051,0.220647890820344,4,"Esr1, Fgf15, Irs1, Ahi1","red","islet",0.0506329113924051
"GO:0005746","mitochondrial respirasome",0,0,34.6261739971348,57,0.192982456140351,0.398147338629992,11,"Cox6a1, Cox7a2, Ndufa2, Ndufa4, Ndufs4, Ndufa13, Ndufb8, Ndufb4, Ndufb2, Ndufv3, Ndufs6","saddlebrown","islet",0.192982456140351
"GO:0005747","mitochondrial respiratory chain complex I",0,0,36.2140120705816,35,0.257142857142857,0.44343957363116,9,"Ndufa2, Ndufa4, Ndufs4, Ndufa13, Ndufb8, Ndufb4, Ndufb2, Ndufv3, Ndufs6","saddlebrown","islet",0.257142857142857
"GO:0006119","oxidative phosphorylation",0,0,26.2645251024608,98,0.112244897959184,0.31729049622439,11,"Atp5j, Cox6a1, Cox7a2, Ndufa2, Ndufs4, Ndufa13, Ndufb8, Ndufb4, Ndufb2, Ndufv3, Ndufs6","saddlebrown","islet",0.112244897959184
"GO:0006164","purine nucleotide biosynthetic process",0,0,17.6871742710287,174,0.0574712643678161,0.233412574222831,10,"Atp5j, Ndufa2, Ndufs4, Ndufa13, Ndufb8, Ndufb4, Ndufb2, Mpc2, Ndufv3, Ndufs6","saddlebrown","islet",0.0574712643678161
"GO:0006754","ATP biosynthetic process",0,0,25.0926517771786,72,0.125,0.333039776840164,9,"Atp5j, Ndufa2, Ndufs4, Ndufa13, Ndufb8, Ndufb4, Ndufb2, Ndufv3, Ndufs6","saddlebrown","islet",0.125
"GO:0009060","aerobic respiration",0,0,22.4402968352525,133,0.0827067669172932,0.276479841501857,11,"Atp5j, Cox6a1, Cox7a2, Ndufa2, Ndufs4, Ndufa13, Ndufb8, Ndufb4, Ndufb2, Ndufv3, Ndufs6","saddlebrown","islet",0.0827067669172932
"GO:0009142","nucleoside triphosphate biosynthetic process",0,0,22.1233768130215,92,0.0978260869565217,0.298707200113932,9,"Atp5j, Ndufa2, Ndufs4, Ndufa13, Ndufb8, Ndufb4, Ndufb2, Ndufv3, Ndufs6","saddlebrown","islet",0.0978260869565217
"GO:0009145","purine nucleoside triphosphate biosynthetic process",0,0,23.9268971068769,79,0.113924050632911,0.319749171412968,9,"Atp5j, Ndufa2, Ndufs4, Ndufa13, Ndufb8, Ndufb4, Ndufb2, Ndufv3, Ndufs6","saddlebrown","islet",0.113924050632911
"GO:0009152","purine ribonucleotide biosynthetic process",0,0,19.2535560906,148,0.0675675675675676,0.251854675788424,10,"Atp5j, Ndufa2, Ndufs4, Ndufa13, Ndufb8, Ndufb4, Ndufb2, Mpc2, Ndufv3, Ndufs6","saddlebrown","islet",0.0675675675675676
"GO:0009201","ribonucleoside triphosphate biosynthetic process",0,0,23.3274598762557,83,0.108433734939759,0.312817572987878,9,"Atp5j, Ndufa2, Ndufs4, Ndufa13, Ndufb8, Ndufb4, Ndufb2, Ndufv3, Ndufs6","saddlebrown","islet",0.108433734939759
"GO:0009206","purine ribonucleoside triphosphate biosynthetic process",0,0,24.0838516498872,78,0.115384615384615,0.321553422305849,9,"Atp5j, Ndufa2, Ndufs4, Ndufa13, Ndufb8, Ndufb4, Ndufb2, Ndufv3, Ndufs6","saddlebrown","islet",0.115384615384615
"GO:0009260","ribonucleotide biosynthetic process",0,0,18.4839291235294,160,0.0625,0.242821465589316,10,"Atp5j, Ndufa2, Ndufs4, Ndufa13, Ndufb8, Ndufb4, Ndufb2, Mpc2, Ndufv3, Ndufs6","saddlebrown","islet",0.0625
"GO:0010257","NADH dehydrogenase complex assembly",0,0,24.7364913325434,45,0.155555555555556,0.366528899738389,7,"Ndufa2, Ndufs4, Ndufa13, Ndufb8, Ndufb4, Ndufb2, Ndufs6","saddlebrown","islet",0.155555555555556
"GO:0015986","proton motive force-driven ATP synthesis",0,0,32.6283394185288,43,0.209302325581395,0.411625091493271,9,"Atp5j, Ndufa2, Ndufs4, Ndufa13, Ndufb8, Ndufb4, Ndufb2, Ndufv3, Ndufs6","saddlebrown","islet",0.209302325581395
"GO:0019646","aerobic electron transport chain",0,0,14.1789973062481,44,0.0909090909090909,0.290803363451153,4,"Cox6a1, Cox7a2, Ndufb8, Ndufs6","saddlebrown","islet",0.0909090909090909
"GO:0022900","electron transport chain",0,0,15.5222620044752,82,0.0731707317073171,0.262019121198305,6,"Cox6a1, Cox7a2, Ndufs4, Ndufb8, Ndufv3, Ndufs6","saddlebrown","islet",0.0731707317073171
"GO:0022904","respiratory electron transport chain",0,0,16.6098745112462,72,0.0833333333333333,0.278324969653092,6,"Cox6a1, Cox7a2, Ndufs4, Ndufb8, Ndufv3, Ndufs6","saddlebrown","islet",0.0833333333333333
"GO:0030964","NADH dehydrogenase complex",0,0,36.2140120705816,35,0.257142857142857,0.44343957363116,9,"Ndufa2, Ndufa4, Ndufs4, Ndufa13, Ndufb8, Ndufb4, Ndufb2, Ndufv3, Ndufs6","saddlebrown","islet",0.257142857142857
"GO:0032981","mitochondrial respiratory chain complex I assembly",0,0,24.7364913325434,45,0.155555555555556,0.366528899738389,7,"Ndufa2, Ndufs4, Ndufa13, Ndufb8, Ndufb4, Ndufb2, Ndufs6","saddlebrown","islet",0.155555555555556
"GO:0033108","mitochondrial respiratory chain complex assembly",0,0,19.5782926232644,71,0.0985915492957746,0.300234650016321,7,"Ndufa2, Ndufs4, Ndufa13, Ndufb8, Ndufb4, Ndufb2, Ndufs6","saddlebrown","islet",0.0985915492957746
"GO:0042773","ATP synthesis coupled electron transport",0,0,16.3245900988463,52,0.0961538461538462,0.297678296192606,5,"Cox6a1, Cox7a2, Ndufb8, Ndufv3, Ndufs6","saddlebrown","islet",0.0961538461538462
"GO:0042775","mitochondrial ATP synthesis coupled electron transport",0,0,16.3245900988463,52,0.0961538461538462,0.297678296192606,5,"Cox6a1, Cox7a2, Ndufb8, Ndufv3, Ndufs6","saddlebrown","islet",0.0961538461538462
"GO:0042776","proton motive force-driven mitochondrial ATP synthesis",0,0,33.8467810761474,40,0.225,0.42290206176626,9,"Atp5j, Ndufa2, Ndufs4, Ndufa13, Ndufb8, Ndufb4, Ndufb2, Ndufv3, Ndufs6","saddlebrown","islet",0.225
"GO:0045271","respiratory chain complex I",0,0,36.2140120705816,35,0.257142857142857,0.44343957363116,9,"Ndufa2, Ndufa4, Ndufs4, Ndufa13, Ndufb8, Ndufb4, Ndufb2, Ndufv3, Ndufs6","saddlebrown","islet",0.257142857142857
"GO:0045333","cellular respiration",0,0,19.1122679137323,181,0.0607734806629834,0.239577077746822,11,"Atp5j, Cox6a1, Cox7a2, Ndufa2, Ndufs4, Ndufa13, Ndufb8, Ndufb4, Ndufb2, Ndufv3, Ndufs6","saddlebrown","islet",0.0607734806629834
"GO:0046034","ATP metabolic process",0,0,15.8630038731983,174,0.0517241379310345,0.222108690242062,9,"Atp5j, Ndufa2, Ndufs4, Ndufa13, Ndufb8, Ndufb4, Ndufb2, Ndufv3, Ndufs6","saddlebrown","islet",0.0517241379310345
"GO:0046390","ribose phosphate biosynthetic process",0,0,18.1303321116239,166,0.0602409638554217,0.238652662041871,10,"Atp5j, Ndufa2, Ndufs4, Ndufa13, Ndufb8, Ndufb4, Ndufb2, Mpc2, Ndufv3, Ndufs6","saddlebrown","islet",0.0602409638554217
"GO:0070469","respirasome",0,0,33.1786958772568,62,0.17741935483871,0.385141811156899,11,"Cox6a1, Cox7a2, Ndufa2, Ndufa4, Ndufs4, Ndufa13, Ndufb8, Ndufb4, Ndufb2, Ndufv3, Ndufs6","saddlebrown","islet",0.17741935483871
"GO:0072522","purine-containing compound biosynthetic process",0,0,17.3233629438195,181,0.0552486187845304,0.229098642172545,10,"Atp5j, Ndufa2, Ndufs4, Ndufa13, Ndufb8, Ndufb4, Ndufb2, Mpc2, Ndufv3, Ndufs6","saddlebrown","islet",0.0552486187845304
"GO:0098798","mitochondrial protein-containing complex",0,0,27.5121547770253,212,0.080188679245283,0.272227884507559,17,"Atp5j, Cox6a1, Cox7a2, Ndufa2, Ndufa4, Ndufs4, Mrps24, Mrpl20, Atp5md, Ndufa13, Ndufb8, Ndufb4, Ndufb2, Atp5mpl, Malsu1, Ndufv3, Ndufs6","saddlebrown","islet",0.080188679245283
"GO:0098800","inner mitochondrial membrane protein complex",0,0,33.895056182947,96,0.145833333333333,0.354791760026154,14,"Atp5j, Cox6a1, Cox7a2, Ndufa2, Ndufa4, Ndufs4, Atp5md, Ndufa13, Ndufb8, Ndufb4, Ndufb2, Atp5mpl, Ndufv3, Ndufs6","saddlebrown","islet",0.145833333333333
"GO:0098803","respiratory chain complex",0,0,34.0252440618671,59,0.186440677966102,0.392804956039492,11,"Cox6a1, Cox7a2, Ndufa2, Ndufa4, Ndufs4, Ndufa13, Ndufb8, Ndufb4, Ndufb2, Ndufv3, Ndufs6","saddlebrown","islet",0.186440677966102
"GO:1990204","oxidoreductase complex",0,0,23.3274598762557,83,0.108433734939759,0.312817572987878,9,"Ndufa2, Ndufa4, Ndufs4, Ndufa13, Ndufb8, Ndufb4, Ndufb2, Ndufv3, Ndufs6","saddlebrown","islet",0.108433734939759
"GO:0019783","ubiquitin-like protein peptidase activity",1.75415237890775e-14,3.80484004091657e-12,7.66800117501809,99,0.0505050505050505,0.220099113746947,5,"Usp15, Usp48, Otud7a, Senp6, Otud7b","salmon","islet",0.0505050505050505
"GO:0004843","cysteine-type deubiquitinase activity",6.66622312905929e-12,1.26519359803604e-09,6.86463423463346,79,0.0506329113924051,0.220647890820344,4,"Usp15, Usp48, Otud7a, Otud7b","salmon","islet",0.0506329113924051
"GO:0001671","ATPase activator activity",0,0,13.7302928396597,22,0.181818181818182,0.394771016975861,4,"Dnaja1, Dnajb2, Dnajb4, Ahsa1","tan","islet",0.181818181818182
"GO:0006457","protein folding",0,0,12.2625606904688,131,0.0687022900763359,0.253918208958848,9,"Dnaja1, Hsph1, Stip1, Dnajb2, Dnaja4, Chordc1, Dnajb4, St13, Ahsa1","tan","islet",0.0687022900763359
"GO:0030544","Hsp70 protein binding",0,0,12.138968274797,43,0.116279069767442,0.324353006224288,5,"Dnaja1, Stip1, Dnajb2, Dnaja4, St13","tan","islet",0.116279069767442
"GO:0031072","heat shock protein binding",0,0,10.0024031466577,117,0.0598290598290598,0.238189952110028,7,"Dnaja1, Stip1, Dnajb2, Dnaja4, Chordc1, St13, Ahsa1","tan","islet",0.0598290598290598
"GO:0042026","protein refolding",0,0,16.735403137117,15,0.266666666666667,0.457737708217063,4,"Dnaja1, Dnajb2, Dnaja4, St13","tan","islet",0.266666666666667
"GO:0051082","unfolded protein binding",0,0,9.39821090428662,69,0.072463768115942,0.261153582247854,5,"Dnaja1, Dnajb2, Dnaja4, Dnajb4, St13","tan","islet",0.072463768115942
"GO:0051087","chaperone binding",0,0,10.9182012608018,100,0.07,0.256432399976243,7,"Dnaja1, Stip1, Dnajb2, Dnaja4, Dnajb4, St13, Ahsa1","tan","islet",0.07
"GO:0060590","ATPase regulator activity",0,0,13.1443607267304,37,0.135135135135135,0.346583496606691,5,"Dnaja1, Hsph1, Dnajb2, Dnajb4, Ahsa1","tan","islet",0.135135135135135
"GO:0061077","chaperone-mediated protein folding",0,0,10.9650482930418,52,0.0961538461538462,0.297678296192606,5,"Hsph1, Dnajb2, Chordc1, Dnajb4, St13","tan","islet",0.0961538461538462
"GO:1902369","negative regulation of RNA catabolic process",2.93098878501041e-13,7.21656968417429e-11,7.29753961953834,71,0.0563380281690141,0.232214429455805,4,"Hnrnpd, Nrde2, Tardbp, Fus","tan","islet",0.0563380281690141
"GO:0005216","monoatomic ion channel activity",5.11856196316884e-07,0.0044390438212189,5.02181444974918,357,0.235294117647059,0.424777847152594,84,"Asic2, Chrna1, Chrna6, Chrng, Cacna1s, Cacng2, Clcn5, Gabra1, Gabra4, Gabrg3, Gria2, Grid1, Grik3, Grik5, Grin2d, Itgav, Itpr1, Itpr2, Kcnc1, Kcnd2, Kcnj10, Kcnj3, Kcnj9, Kcnk4, Kcnq1, Oprm1, Ptk2b, Ryr3, Scn7a, Scn8a, Scnn1b, Scnn1g, Slc1a1, Trpc1, Clca1, Best1, Clcn6, Kcnk6, Gria3, Cacng4, Panx1, Trpm5, Cacna1h, Kcnmb4, Kcnk10, Pkd1l2, Lrg1, Kcnip4, Slc24a3, Clca4b, Chrnb3, Grik4, Scn2a, Bsnd, Kcnh7, Trpm8, Tmc2, Kcnh8, Best2, Mcu, Tmc8, Kcnk9, Apol9a, Trpm3, P2rx3, P2rx2, Cnga4, Tpcn2, Scn3b, Kcnh5, Calhm3, Kcnt2, Lrrc52, Kcng1, Grin3a, Tmem266, Kcne2, Trpv3, Kcnc2, Cngb1, Kcnh4, Ano8, Lrrc8b, Calhm1","turquoise","islet",0.235294117647059
"GO:0005261","monoatomic cation channel activity",7.20487761451949e-07,0.0044390438212189,4.95575819092285,260,0.25,0.433847828419065,65,"Asic2, Chrna1, Chrna6, Chrng, Cacna1s, Cacng2, Gria2, Grik3, Grik5, Grin2d, Itgav, Itpr1, Itpr2, Kcnc1, Kcnd2, Kcnj10, Kcnj3, Kcnj9, Kcnk4, Kcnq1, Oprm1, Ryr3, Scn7a, Scn8a, Scnn1b, Scnn1g, Trpc1, Kcnk6, Cacng4, Panx1, Trpm5, Cacna1h, Kcnmb4, Kcnk10, Pkd1l2, Lrg1, Kcnip4, Slc24a3, Chrnb3, Grik4, Scn2a, Kcnh7, Trpm8, Tmc2, Kcnh8, Mcu, Kcnk9, Trpm3, P2rx3, P2rx2, Cnga4, Tpcn2, Scn3b, Kcnh5, Calhm3, Kcnt2, Lrrc52, Kcng1, Grin3a, Kcne2, Trpv3, Kcnc2, Cngb1, Kcnh4, Calhm1","turquoise","islet",0.25
"GO:0022836","gated channel activity",1.02794481815494e-06,0.0044390438212189,4.88621205572388,262,0.248091603053435,0.432731880574588,65,"Asic2, Chrna1, Chrna6, Chrng, Cacna1s, Cacng2, Clcn5, Gabra1, Gabra4, Gabrg3, Gria2, Grid1, Grik3, Grik5, Grin2d, Itgav, Itpr1, Itpr2, Kcnc1, Kcnd2, Kcnj10, Kcnj3, Kcnj9, Kcnk4, Kcnq1, Oprm1, Ptk2b, Ryr3, Scn8a, Scnn1b, Scnn1g, Clcn6, Gria3, Cacng4, Trpm5, Cacna1h, Kcnmb4, Lrg1, Kcnip4, Chrnb3, Grik4, Scn2a, Kcnh7, Trpm8, Tmc2, Kcnh8, Tmc8, Kcnk9, P2rx3, P2rx2, Cnga4, Tpcn2, Scn3b, Kcnh5, Calhm3, Kcnt2, Lrrc52, Kcng1, Grin3a, Tmem266, Kcne2, Kcnc2, Cngb1, Kcnh4, Calhm1","turquoise","islet",0.248091603053435
"GO:0042391","regulation of membrane potential",1.07199741017361e-06,0.0044390438212189,4.87793959464604,427,0.224824355971897,0.41795630043912,96,"Asic2, Chrna1, Chrna6, Chrng, Adora2a, Adra1a, Adrb1, Ank3, App, Atp1b1, Atp1b2, Bid, Cacng2, Cck, Cln3, Cnih2, Dlg4, Dmpk, Dmd, Drd4, Dsg2, Fgf14, Fhl1, Gabra1, Gabra4, Gabrg3, Gclc, Gna14, Gna15, Gnaq, Grik3, Grik5, Grin2d, Hcrt, Jup, Kcnd2, Kcnj10, Kcnj9, Kcnk4, Kcnq1, Mecp2, Nrxn1, Ntrk2, Ntrk3, Oprm1, Ptk2b, Ptn, Scn7a, Scn8a, Cx3cl1, Slc8a1, Stx1a, Tnf, Ucp2, Kcnk6, Cntnap1, Gria3, Gabbr1, Slc4a4, Cacna1h, Kcnmb4, Tspan4, Cntnap2, Kcnk10, Trdn, Popdc3, Nedd4l, Celf4, Chrnb3, Foxp1, Nr3c2, Scn2a, Slc8a3, Rims2, Kcnh7, Nlgn1, Igsf11, Kcnh8, Best2, Ctnna3, Kcnk9, Tbc1d24, Pip5kl1, P2rx3, P2rx2, Ssh1, Scn3b, Kcnh5, Kcne2, Neto1, Kcnc2, Insyn1, Cngb1, Kcnh4, Begain, Ptpn3","turquoise","islet",0.224824355971897
"GO:0098976","excitatory chemical synaptic transmission",1.38069461574908e-06,0.005234737759668,4.82777138792506,6,0.833333333333333,0.408248290463863,5,"Pdlim4, Cntnap2, Chrdl1, Ptchd1, Ssh1","turquoise","islet",0.833333333333333
"GO:0022839","monoatomic ion gated channel activity",1.49399760429603e-06,0.005234737759668,4.81203689976079,259,0.247104247104247,0.432162976118534,64,"Asic2, Chrna1, Chrna6, Chrng, Cacna1s, Cacng2, Clcn5, Gabra1, Gabra4, Gabrg3, Gria2, Grid1, Grik3, Grik5, Grin2d, Itgav, Itpr1, Itpr2, Kcnc1, Kcnd2, Kcnj10, Kcnj3, Kcnj9, Kcnk4, Kcnq1, Oprm1, Ptk2b, Ryr3, Scn8a, Scnn1b, Scnn1g, Clcn6, Gria3, Cacng4, Trpm5, Cacna1h, Kcnmb4, Lrg1, Kcnip4, Chrnb3, Grik4, Scn2a, Kcnh7, Trpm8, Tmc2, Kcnh8, Tmc8, Kcnk9, P2rx3, P2rx2, Cnga4, Tpcn2, Scn3b, Kcnh5, Calhm3, Kcnt2, Lrrc52, Kcng1, Grin3a, Kcne2, Kcnc2, Cngb1, Kcnh4, Calhm1","turquoise","islet",0.247104247104247
"GO:0004970","ionotropic glutamate receptor activity",1.65580622057959e-06,0.0053872838105286,4.79144959373119,16,0.5625,0.51234753829798,9,"Gria2, Grid1, Grik3, Grik5, Grin2d, Ptk2b, Gria3, Grik4, Grin3a","turquoise","islet",0.5625
"GO:0099094","ligand-gated monoatomic cation channel activity",2.04143189419526e-06,0.00619914818537293,4.74927895771033,83,0.325301204819277,0.471335252622148,27,"Asic2, Chrna1, Chrna6, Chrng, Gria2, Grik3, Grik5, Grin2d, Itpr1, Itpr2, Kcnj10, Kcnj3, Kcnj9, Ryr3, Scnn1b, Scnn1g, Trpm5, Chrnb3, Grik4, Kcnh7, Trpm8, P2rx3, P2rx2, Cnga4, Tpcn2, Kcne2, Cngb1","turquoise","islet",0.325301204819277
"GO:0022010","central nervous system myelination",2.66139397808729e-06,0.00713097033540447,4.6953586144852,29,0.448275862068966,0.506120178878476,13,"Ercc2, Gpm6b, Nkx6-2, Kcnj10, Plp1, Sox10, Tenm4, Cntnap1, B4galt5, B4galt6, Cntnap2, Myrf, 9630013A20Rik","turquoise","islet",0.448275862068966
"GO:0032291","axon ensheathment in central nervous system",2.66139397808729e-06,0.00713097033540447,4.6953586144852,29,0.448275862068966,0.506120178878476,13,"Ercc2, Gpm6b, Nkx6-2, Kcnj10, Plp1, Sox10, Tenm4, Cntnap1, B4galt5, B4galt6, Cntnap2, Myrf, 9630013A20Rik","turquoise","islet",0.448275862068966
"GO:1901702","salt transmembrane transporter activity",5.04190770778123e-06,0.0114829448044718,4.56303636679585,473,0.215644820295983,0.411704364501516,102,"Asic2, Atp1b1, Atp1b2, Atp7b, Cacna1s, Cacng2, Clcn5, Slc6a3, Gabra1, Gabra4, Gabrg3, Gria2, Grik3, Grik5, Grin2d, Itgav, Itpr1, Itpr2, Kcnc1, Kcnd2, Kcnj10, Kcnj3, Kcnj9, Kcnk4, Kcnq1, Oprm1, Ryr3, Scn7a, Scn8a, Scnn1b, Scnn1g, Slc12a7, Slc16a1, Slc16a7, Slc1a1, Slc1a2, Slc34a2, Slc4a1, Slc4a2, Slc8a1, Trpc1, Ucp2, Slc6a18, Clca1, Best1, Clcn6, Slc25a10, Abcg3, Kcnk6, Slc46a1, Slc52a2, Atp2a3, Slc23a2, Cacng4, Slc4a4, Panx1, Slc6a14, Trpm5, Slc16a8, Cacna1h, Kcnmb4, Slc52a3, Kcnk10, Pkd1l2, Lrg1, Kcnip4, Slc16a3, Slc24a3, Sfxn5, Clca4b, Slc25a41, Slc6a5, Grik4, Scn2a, Slc8a3, Bsnd, Kcnh7, Trpm8, Tmc2, Kcnh8, Best2, Mcu, Slc26a10, Slc16a11, Kcnk9, Apol9a, Slc25a24, Tpcn2, Scn3b, Slc9a7, Kcnh5, Slc30a8, Kcnt2, Lrrc52, Kcng1, Grin3a, Kcne2, Trpv3, Kcnc2, Kcnh4, Ano8, Calhm1","turquoise","islet",0.215644820295983
"GO:0060078","regulation of postsynaptic membrane potential",6.42633892966593e-06,0.0139390351545849,4.51185409693404,118,0.288135593220339,0.454825878494106,34,"Chrng, Adora2a, Adrb1, App, Dlg4, Dmpk, Drd4, Fgf14, Gabra1, Gabra4, Gabrg3, Grik5, Grin2d, Hcrt, Mecp2, Nrxn1, Oprm1, Ptk2b, Cx3cl1, Stx1a, Gria3, Gabbr1, Cntnap2, Celf4, Nr3c2, Slc8a3, Rims2, Nlgn1, Igsf11, Tbc1d24, Ssh1, Neto1, Insyn1, Begain","turquoise","islet",0.288135593220339
"GO:0010749","regulation of nitric oxide mediated signal transduction",7.27965736602165e-06,0.0144168866531429,4.48534346594292,9,0.666666666666667,0.5,6,"Cbs, Egfr, Ins1, Ins2, Gucy1a1, Gucy1a2","turquoise","islet",0.666666666666667
"GO:0015276","ligand-gated monoatomic ion channel activity",8.37401644737668e-06,0.0152574579671203,4.45539169038047,119,0.285714285714286,0.453664124672128,34,"Asic2, Chrna1, Chrna6, Chrng, Gabra1, Gabra4, Gabrg3, Gria2, Grid1, Grik3, Grik5, Grin2d, Itpr1, Itpr2, Kcnj10, Kcnj3, Kcnj9, Ptk2b, Ryr3, Scnn1b, Scnn1g, Gria3, Trpm5, Chrnb3, Grik4, Kcnh7, Trpm8, P2rx3, P2rx2, Cnga4, Tpcn2, Grin3a, Kcne2, Cngb1","turquoise","islet",0.285714285714286
"GO:0098982","GABA-ergic synapse",9.06291359492606e-06,0.0158775274711108,4.43840222832478,124,0.282258064516129,0.451924230482319,35,"Adra1a, Adra2a, Bsn, Calb1, Cck, Ncan, Drd4, Efna5, Erbb4, Gabra1, Gabra4, Gabrg3, Grid1, Hap1, Itpr1, Kcnd2, Nrxn1, Nrxn3, Oprm1, Nbea, Gabbr1, Syt7, Gucy1a1, Clstn1, Cntnap2, Grip1, Mdga1, Nr3c2, Rims2, Cntnap4, Nlgn1, Slc6a17, Disc1, Kcnc2, Gphn","turquoise","islet",0.282258064516129
"GO:0099565","chemical synaptic transmission, postsynaptic",1.26588763189606e-05,0.018839121269912,4.36592007775798,102,0.294117647058824,0.457895212495274,30,"Chrng, Adora2a, Adrb1, App, Dlg4, Dmpk, Drd4, Grik5, Grin2d, Hcrt, Mecp2, Nrxn1, Oprm1, Ptk2b, Cx3cl1, Stx1a, Gria3, Gabbr1, Cntnap2, Anks1b, Celf4, Slc8a3, Rims2, Nlgn1, Igsf11, Tbc1d24, Ssh1, Neto1, Insyn1, Begain","turquoise","islet",0.294117647058824
"GO:0022834","ligand-gated channel activity",1.39846349005435e-05,0.018839121269912,4.34410228595652,121,0.28099173553719,0.451352421356597,34,"Asic2, Chrna1, Chrna6, Chrng, Gabra1, Gabra4, Gabrg3, Gria2, Grid1, Grik3, Grik5, Grin2d, Itpr1, Itpr2, Kcnj10, Kcnj3, Kcnj9, Ptk2b, Ryr3, Scnn1b, Scnn1g, Gria3, Trpm5, Chrnb3, Grik4, Kcnh7, Trpm8, P2rx3, P2rx2, Cnga4, Tpcn2, Grin3a, Kcne2, Cngb1","turquoise","islet",0.28099173553719
"GO:0008328","ionotropic glutamate receptor complex",1.40621322322065e-05,0.018839121269912,4.34288879661324,35,0.4,0.497050121747708,14,"Cacng2, Cnih2, Dlg4, Gria2, Grik3, Grik5, Grin2d, Ptk2b, Gria3, Cacng4, Nrn1, Grik4, Olfm3, Grin3a","turquoise","islet",0.4
"GO:0008324","monoatomic cation transmembrane transporter activity",1.61105221090363e-05,0.0207878725091753,4.31292988592713,461,0.212581344902386,0.409578330883717,98,"Asic2, Chrna1, Chrna6, Chrng, Atp1b1, Atp1b2, Atp6v0a1, Atp7b, Cacna1s, Cacng2, Cox6a2, Slc6a3, Gria2, Grik3, Grik5, Grin2d, Itgav, Itpr1, Itpr2, Kcnc1, Kcnd2, Kcnj10, Kcnj3, Kcnj9, Kcnk4, Kcnq1, Oprm1, Ryr3, Scn7a, Scn8a, Scnn1b, Scnn1g, Slc12a7, Slc16a1, Slc1a1, Slc1a2, Slc34a2, Slc8a1, Trpc1, Ucp2, Slc6a18, Kcnk6, Slc46a1, Atp2a3, Slc40a1, Slc23a2, Cacng4, Slc4a4, Panx1, Slc6a14, Trpm5, Cacna1h, Kcnmb4, Slc25a37, Mfsd3, Kcnk10, Pkd1l2, Lrg1, Kcnip4, Slc16a3, Cox4i2, Slc24a3, Slc6a5, Chrnb3, Grik4, Scn2a, Slc8a3, Kcnh7, Atp13a1, Trpm8, Tmc2, Kcnh8, Nipal4, Slc36a1, Mcu, Kcnk9, Trpm3, P2rx3, P2rx2, Cnga4, Tpcn2, Scn3b, Slc9a7, Kcnh5, Slc30a8, Calhm3, Kcnt2, Lrrc52, Kcng1, Grin3a, Slc29a4, Zdhhc13, Kcne2, Trpv3, Kcnc2, Cngb1, Kcnh4, Calhm1","turquoise","islet",0.212581344902386
"GO:0070371","ERK1 and ERK2 cascade",1.64294930917741e-05,0.0207878725091753,4.30859496440661,290,0.231034482758621,0.422223024649117,67,"Adra1a, Alox15, App, Avp, Cflar, Crhr2, Dab2, Dcc, Dmd, Egf, Egfr, Erbb4, Esr1, Fgf4, Fgfr2, Flt4, Fshr, Grb10, Ins2, Itgav, Itgb1bp1, Mt3, Ngf, Notch2, Nrp1, Nrxn1, Oprm1, Ptk2b, Ptprr, Rara, Ros1, Ccl17, Ccl22, Cx3cl1, Sema6a, Syk, Trf, Pin1, Spry2, Map2k1, Pdgfc, Sirt3, Cntnap2, Dusp6, Ace2, Dusp3, Bmyc, Arrb1, Braf, Spred2, Necab2, Ripk2, Dstyk, Rap1b, Gpbar1, Gpr55, Hcrtr1, Ndrg4, Pin1rt1, Dusp15, Ephb1, Scimp, Pramel7, Glipr2, Alkal1, Nek10, Ccl21d","turquoise","islet",0.231034482758621
"GO:0099529","neurotransmitter receptor activity involved in regulation of postsynaptic membrane potential",1.83826006319165e-05,0.0213348731100025,4.28368150379791,47,0.361702127659574,0.485687854441406,17,"Chrna1, Chrna6, Chrng, Adrb1, Gabra1, Gabra4, Gabrg3, Gria2, Grid1, Grik3, Grik5, Grin2d, Gria3, Gabbr1, Chrnb3, Grik4, Grin3a","turquoise","islet",0.361702127659574
"GO:0098878","neurotransmitter receptor complex",2.50798657321916e-05,0.0223997624333593,4.21407975464374,36,0.388888888888889,0.494413232473044,14,"Cacng2, Cnih2, Dlg4, Gria2, Grik3, Grik5, Grin2d, Ptk2b, Gria3, Cacng4, Nrn1, Grik4, Olfm3, Grin3a","turquoise","islet",0.388888888888889
"GO:0015267","channel activity",2.96860151640654e-05,0.0226936337682499,4.17586169528748,399,0.215538847117794,0.411711891103542,86,"Asic2, Chrna1, Chrna6, Chrng, Cacna1s, Cacng2, Clcn5, Gabra1, Gabra4, Gabrg3, Gja8, Gria2, Grid1, Grik3, Grik5, Grin2d, Itgav, Itpr1, Itpr2, Kcnc1, Kcnd2, Kcnj10, Kcnj3, Kcnj9, Kcnk4, Kcnq1, Oprm1, Ptk2b, Ryr3, Scn7a, Scn8a, Scnn1b, Scnn1g, Slc12a7, Slc1a1, Trpc1, Clca1, Best1, Clcn6, Kcnk6, Gria3, Cacng4, Panx1, Trpm5, Cacna1h, Kcnmb4, Kcnk10, Pkd1l2, Lrg1, Kcnip4, Slc24a3, Clca4b, Chrnb3, Grik4, Scn2a, Bsnd, Kcnh7, Trpm8, Tmc2, Kcnh8, Best2, Mcu, Tmc8, Kcnk9, Apol9a, Trpm3, P2rx3, P2rx2, Cnga4, Tpcn2, Scn3b, Kcnh5, Calhm3, Kcnt2, Lrrc52, Kcng1, Grin3a, Tmem266, Kcne2, Trpv3, Kcnc2, Cngb1, Kcnh4, Ano8, Lrrc8b, Calhm1","turquoise","islet",0.215538847117794
"GO:0022803","passive transmembrane transporter activity",2.96860151640654e-05,0.0226936337682499,4.17586169528748,399,0.215538847117794,0.411711891103542,86,"Asic2, Chrna1, Chrna6, Chrng, Cacna1s, Cacng2, Clcn5, Gabra1, Gabra4, Gabrg3, Gja8, Gria2, Grid1, Grik3, Grik5, Grin2d, Itgav, Itpr1, Itpr2, Kcnc1, Kcnd2, Kcnj10, Kcnj3, Kcnj9, Kcnk4, Kcnq1, Oprm1, Ptk2b, Ryr3, Scn7a, Scn8a, Scnn1b, Scnn1g, Slc12a7, Slc1a1, Trpc1, Clca1, Best1, Clcn6, Kcnk6, Gria3, Cacng4, Panx1, Trpm5, Cacna1h, Kcnmb4, Kcnk10, Pkd1l2, Lrg1, Kcnip4, Slc24a3, Clca4b, Chrnb3, Grik4, Scn2a, Bsnd, Kcnh7, Trpm8, Tmc2, Kcnh8, Best2, Mcu, Tmc8, Kcnk9, Apol9a, Trpm3, P2rx3, P2rx2, Cnga4, Tpcn2, Scn3b, Kcnh5, Calhm3, Kcnt2, Lrrc52, Kcng1, Grin3a, Tmem266, Kcne2, Trpv3, Kcnc2, Cngb1, Kcnh4, Ano8, Lrrc8b, Calhm1","turquoise","islet",0.215538847117794
"GO:0097120","receptor localization to synapse",2.97969377101026e-05,0.0226936337682499,4.17501274066547,69,0.318840579710145,0.469441270623243,22,"Cacng2, Cnih2, Dlg4, Erbb4, Kif5a, Nrxn1, Nrxn3, Dlg2, Map2k1, Mapk10, Nbea, Cacng4, Lgi1, Clstn1, Nptxr, Grip1, Anks1b, Nlgn1, C1ql3, Neto1, Gphn, Kalrn","turquoise","islet",0.318840579710145
"GO:0008211","glucocorticoid metabolic process",3.00867431535234e-05,0.0226936337682499,4.17280878711423,22,0.454545454545455,0.509647191437625,10,"Apoa1, Serpina6, Cyp17a1, Hsd11b2, Mecp2, Rest, Wnt4, Cacna1h, H6pd, Cyp11b1","turquoise","islet",0.454545454545455
"GO:1990806","ligand-gated ion channel signaling pathway",3.117158749677e-05,0.0226936337682499,4.16473392812094,29,0.413793103448276,0.501230014158765,12,"App, Cln3, Gnaq, Gria2, Grin2d, Itpr1, Plp1, Ptk2b, Trpc1, Ffar2, Grin3a, Kalrn","turquoise","islet",0.413793103448276
