"GO_ID","Term","p.value","p.adj","z.score","set.size","set.mean","set.sd","num.overlap","Genes","module","tissue","fraction_overlap"
"GO:0000956","nuclear-transcribed mRNA catabolic process",0.00141907122625562,0.0354378806776006,3.19074366560342,99,0.101010101010101,0.302875656272066,10,"Gtpbp2, Syncrip, Upf3b, Pan2, Tnrc6b, Tnrc6c, Thrap3, Tnrc6a, Edc4, Ctif","blue","islet",0.101010101010101
"GO:0043254","regulation of protein-containing complex assembly",0.00149108636751327,0.0370939290225175,3.17641274629957,367,0.0708446866485014,0.256915489428002,26,"Apc, Bcl2l11, Cdc42, Dlg1, Ica1, Mecp2, Map1b, Nck1, Sptan1, Sptbn1, Vegfa, Arhgef7, Arhgef5, Snx9, Zdhhc1, Clasp2, Cyfip2, Plekhg2, Aida, Dut, Raf1, Eif4g1, Senp6, Dhx33, Fermt2, Zfp827","blue","islet",0.0708446866485014
"GO:0006984","ER-nucleus signaling pathway",0.00150938532447253,0.0374877325680065,3.17287300343626,35,0.142857142857143,0.355035801248363,5,"Atp2a2, Bcl2l11, Nck1, Qrich1, Erlin1","blue","islet",0.142857142857143
"GO:0030135","coated vesicle",0.001624115903337,0.0402494447208924,3.15154058450425,161,0.0869565217391304,0.282650498580537,14,"App, Dnajc5, Dvl1, Gnas, Syp, Vti1a, Uso1, Snx9, Rab14, Ap1s2, Aftph, Clint1, Sec16a, Dennd1a","blue","islet",0.0869565217391304
"GO:0045191","regulation of isotype switching",0.00178685712209004,0.0441145484613556,3.12354636174858,25,0.16,0.374165738677394,4,"Bcl6, Supt6, Nsd2, Thoc1","blue","islet",0.16
"GO:0080008","Cul4-RING E3 ubiquitin ligase complex",0.00178685712209004,0.0441145484613556,3.12354636174858,25,0.16,0.374165738677394,4,"Dcaf12, Dcaf8, Cul4a, Dcaf5","blue","islet",0.16
"GO:1902473","regulation of protein localization to synapse",0.00178685712209004,0.0441145484613556,3.12354636174858,25,0.16,0.374165738677394,4,"Dlg1, Ogt, Abhd17b, Tnik","blue","islet",0.16
"GO:0010498","proteasomal protein catabolic process",0.00181323745849871,0.0447415851758484,3.11923099707804,408,0.0686274509803922,0.253129946780548,28,"Apc, Trip12, Man1a, Rad23b, Ube2b, Rnf103, Arih2, Fbxl12, Rnf19a, Ankzf1, Dnajb12, Rnf14, Marchf7, Rpl11, Rchy1, Dcaf12, Trim39, Cul4a, Jkamp, Prickle1, Wwp1, Ogt, Klhl22, Ubr2, Erlin1, Phf20l1, Fem1c, Akirin2","blue","islet",0.0686274509803922
"GO:0045666","positive regulation of neuron differentiation",0.00181502414720858,0.0447614238794535,3.11894081638955,101,0.099009900990099,0.30016497114252,10,"App, Bcl6, Map1b, Rara, Tcf12, Tcf4, Upf3b, Spag9, Lin28a, Eif4g1","blue","islet",0.099009900990099
"GO:0055117","regulation of cardiac muscle contraction",0.00188175260043466,0.046381943154653,3.10828695795747,60,0.116666666666667,0.323731771513093,7,"Atp2a2, Cacna1c, Calm2, Dlg1, Sri, Hdac4, Pde4d","blue","islet",0.116666666666667
"GO:0003730","mRNA 3'-UTR binding",0.0018850006040807,0.0464368726424423,3.1077772878633,87,0.103448275862069,0.306308962377922,9,"Tia1, Tial1, Syncrip, Larp1, Hnrnpr, Tardbp, Cpeb2, Fus, Rbm47","blue","islet",0.103448275862069
"GO:1990138","neuron projection extension",0.00189905152449898,0.0467577280761777,3.10558169748618,179,0.0837988826815642,0.277863202537845,15,"Dvl1, Mecp2, Map1b, Ptprs, Sema6a, Itsn2, Vegfa, Ulk2, Rufy3, Golga4, Spag9, Clasp2, Cyfip2, Prickle1, Dip2b","blue","islet",0.0837988826815642
"GO:0032008","positive regulation of TOR signaling",0.00196845430767278,0.048388070002426,3.0949509748489,36,0.138888888888889,0.350736187206101,5,"Sik3, Gpr137c, Lin28a, Klhl22, Slc38a9","blue","islet",0.138888888888889
"GO:0043543","protein acylation",0.00200930605058014,0.0493656367874463,3.08885333511727,213,0.07981220657277,0.271640651988175,17,"App, Mecp2, Actl6a, Brd4, Zdhhc6, Zdhhc1, Zdhhc20, Kansl1, Brd8, Sf3b3, Ogt, Tada2a, Kansl3, Phf20l1, Dip2b, Atxn7, Cep295","blue","islet",0.07981220657277
"GO:0005797","Golgi medial cisterna",0,0,8.55956225227134,20,0.3,0.470162345981627,6,"H2-D1, H2-K1, H2-Q1, H2-Q4, Yipf6, B3galt6","brown","islet",0.3
"GO:0015095","magnesium ion transmembrane transporter activity",0,0,8.29930660818767,15,0.333333333333333,0.487950036474267,5,"Magt1, Nipal3, Nipa2, Mmgt1, Zdhhc17","brown","islet",0.333333333333333
"GO:0062061","TAP complex binding",0,0,9.30000837980527,8,0.5,0.534522483824849,4,"H2-D1, H2-K1, H2-Q1, H2-Q4","brown","islet",0.5
"GO:0031985","Golgi cisterna",1.33226762955019e-15,4.66806080969316e-12,7.99230224390813,57,0.175438596491228,0.38372269644813,10,"H2-D1, H2-K1, H2-Q1, H2-Q4, Furin, Atl1, Yipf6, Csgalnact2, Golga2, B3galt6","brown","islet",0.175438596491228
"GO:0042824","MHC class I peptide loading complex",6.43929354282591e-15,1.95539880583813e-11,7.79718158344578,11,0.363636363636364,0.504524979109513,4,"H2-D1, H2-K1, H2-Q1, H2-Q4","brown","islet",0.363636363636364
"GO:0090158","endoplasmic reticulum membrane organization",6.43929354282591e-15,1.95539880583813e-11,7.79718158344578,11,0.363636363636364,0.504524979109513,4,"Atl2, Tmed2, Atl1, Bnip1","brown","islet",0.363636363636364
"GO:0098791","Golgi apparatus subcompartment",9.54791801177635e-15,2.71817290897758e-11,7.74520520621174,266,0.0902255639097744,0.28704471064637,24,"Adam10, H2-D1, H2-K1, H2-Q1, H2-Q4, M6pr, Furin, Stx4a, Tmem165, Tgoln1, Becn1, Golga7, Yipf5, Vps51, Atl1, Trappc9, Yipf6, Trappc6b, Csgalnact2, Plekha3, Golga2, Scamp1, B3galt6, Ocrl","brown","islet",0.0902255639097744
"GO:0016558","protein import into peroxisome matrix",1.15019105351166e-13,2.61956012437281e-10,7.4224975270789,12,0.333333333333333,0.492365963917331,4,"Pex7, Pex2, Usp9x, Pex13","brown","islet",0.333333333333333
"GO:0005795","Golgi stack",9.50794998288984e-13,1.05067284160607e-09,7.13743461453772,80,0.1375,0.346547163758212,11,"H2-D1, H2-K1, H2-Q1, H2-Q4, Furin, Golga7, Atl1, Yipf6, Csgalnact2, Golga2, B3galt6","brown","islet",0.1375
"GO:0015693","magnesium ion transport",1.10007558618008e-11,1.05067284160607e-09,6.79275998111703,14,0.285714285714286,0.468807230938495,4,"Magt1, Nipal3, Nipa2, Mmgt1","brown","islet",0.285714285714286
"GO:0042610","CD8 receptor binding",6.83657574995777e-11,4.02333366163536e-09,6.52419937029372,15,0.266666666666667,0.457737708217063,4,"H2-D1, H2-K1, H2-Q1, H2-Q4","brown","islet",0.266666666666667
"GO:0007031","peroxisome organization",1.09328768260752e-10,6.42571018616422e-09,6.45345468751219,32,0.1875,0.396557769456266,6,"Pex7, Pex2, Usp9x, Pex13, Dnm1l, Mff","brown","islet",0.1875
"GO:0006625","protein targeting to peroxisome",3.38550076861566e-10,1.97704564115953e-08,6.28001053133222,16,0.25,0.447213595499958,4,"Pex7, Pex2, Usp9x, Pex13","brown","islet",0.25
"GO:0008334","histone mRNA metabolic process",3.38550076861566e-10,1.97704564115953e-08,6.28001053133222,16,0.25,0.447213595499958,4,"Atm, Cpsf2, Mtpap, Ncbp2","brown","islet",0.25
"GO:0032398","MHC class Ib protein complex",3.38550076861566e-10,1.97704564115953e-08,6.28001053133222,16,0.25,0.447213595499958,4,"H2-D1, H2-K1, H2-Q1, H2-Q4","brown","islet",0.25
"GO:0072662","protein localization to peroxisome",3.38550076861566e-10,1.97704564115953e-08,6.28001053133222,16,0.25,0.447213595499958,4,"Pex7, Pex2, Usp9x, Pex13","brown","islet",0.25
"GO:0072663","establishment of protein localization to peroxisome",3.38550076861566e-10,1.97704564115953e-08,6.28001053133222,16,0.25,0.447213595499958,4,"Pex7, Pex2, Usp9x, Pex13","brown","islet",0.25
"GO:0042612","MHC class I protein complex",1.39037337198999e-09,8.06770791008207e-08,6.05659002627772,17,0.235294117647059,0.437237316097603,4,"H2-D1, H2-K1, H2-Q1, H2-Q4","brown","islet",0.235294117647059
"GO:1904358","positive regulation of telomere maintenance via telomere lengthening",2.16830264854195e-09,1.25497059264404e-07,5.98466907052889,26,0.192307692307692,0.40191847623425,5,"Atm, Cct6a, Pkib, Tcp1, Hnrnpa2b1","brown","islet",0.192307692307692
"GO:0007029","endoplasmic reticulum organization",3.16553450119272e-09,1.82982356001686e-07,5.922775196432,74,0.121621621621622,0.329079359321701,9,"Rab18, Esyt2, Atl2, Tmed2, Lnpk, Shtn1, Atl1, Bnip1, Mmgt1","brown","islet",0.121621621621622
"GO:0015919","peroxisomal membrane transport",4.8850179457105e-09,2.80595923615528e-07,5.85104235553652,18,0.222222222222222,0.427792631946499,4,"Pex7, Pex2, Usp9x, Pex13","brown","islet",0.222222222222222
"GO:0030881","beta-2-microglobulin binding",4.8850179457105e-09,2.80595923615528e-07,5.85104235553652,18,0.222222222222222,0.427792631946499,4,"H2-D1, H2-K1, H2-Q1, H2-Q4","brown","islet",0.222222222222222
"GO:0071786","endoplasmic reticulum tubular network organization",4.8850179457105e-09,2.80595923615528e-07,5.85104235553652,18,0.222222222222222,0.427792631946499,4,"Rab18, Atl2, Lnpk, Atl1","brown","islet",0.222222222222222
"GO:0070971","endoplasmic reticulum exit site",5.08644149022075e-09,2.91430704251013e-07,5.84431919618457,27,0.185185185185185,0.39584739066357,5,"H2-D1, H2-K1, H2-Q1, H2-Q4, Yipf5","brown","islet",0.185185185185185
"GO:0019003","GDP binding",2.55764462941954e-08,1.42945659963264e-06,5.56930021882499,66,0.121212121212121,0.328874608564584,8,"Rhoa, Gnai3, Prps1, Rab18, Trim23, Rab28, Rap1a, Rap1b","brown","islet",0.121212121212121
"GO:0043574","peroxisomal transport",4.14516940772103e-08,2.30540252163239e-06,5.48455268383308,20,0.2,0.410391340834062,4,"Pex7, Pex2, Usp9x, Pex13","brown","islet",0.2
"GO:1903306","negative regulation of regulated secretory pathway",4.14516940772103e-08,2.30540252163239e-06,5.48455268383308,20,0.2,0.410391340834062,4,"Stxbp3, Trim9, Rap1a, Rap1b","brown","islet",0.2
"GO:0002476","antigen processing and presentation of endogenous peptide antigen via MHC class Ib",1.0373645165096e-07,5.70675769649906e-06,5.3200540088688,21,0.19047619047619,0.402373908081478,4,"H2-D1, H2-K1, H2-Q1, H2-Q4","brown","islet",0.19047619047619
"GO:0002484","antigen processing and presentation of endogenous peptide antigen via MHC class I via ER pathway",1.0373645165096e-07,5.70675769649906e-06,5.3200540088688,21,0.19047619047619,0.402373908081478,4,"H2-D1, H2-K1, H2-Q1, H2-Q4","brown","islet",0.19047619047619
"GO:0002486","antigen processing and presentation of endogenous peptide antigen via MHC class I via ER pathway, TAP-independent",1.0373645165096e-07,5.70675769649906e-06,5.3200540088688,21,0.19047619047619,0.402373908081478,4,"H2-D1, H2-K1, H2-Q1, H2-Q4","brown","islet",0.19047619047619
"GO:0002428","antigen processing and presentation of peptide antigen via MHC class Ib",2.38955389919582e-07,1.28962298706599e-05,5.16615755235054,22,0.181818181818182,0.394771016975861,4,"H2-D1, H2-K1, H2-Q1, H2-Q4","brown","islet",0.181818181818182
"GO:0055086","nucleobase-containing small molecule metabolic process",2.77643243506986e-07,1.49487585599802e-05,5.1380234491998,492,0.0548780487804878,0.227973864417141,27,"Adss, Rhoa, Atp5pb, Atp6v1b2, Dld, G6pd2, Galk1, Gnai3, Ldha, Mgat1, Mdh1, Prps1, Rab23, Rora, Nudt5, Pmm2, Gucy1b1, Nampt, Cmpk1, Ndufa10, Sdhb, Nudt12, Dnm1l, Mccc2, Ugp2, Gmps, Dlat","brown","islet",0.0548780487804878
"GO:0090307","mitotic spindle assembly",2.91503588822906e-07,1.5676491701161e-05,5.12885898569435,59,0.11864406779661,0.326144973197179,7,"Rhoa, Drg1, Stag2, Bccip, Chmp2b, Mzt1, Golga2","brown","islet",0.11864406779661
"GO:0016486","peptide hormone processing",5.12123592422142e-07,2.731525718364e-05,5.02171415936434,23,0.173913043478261,0.38755338788159,4,"Adam10, Furin, Yipf5, Disp1","brown","islet",0.173913043478261
"GO:0032212","positive regulation of telomere maintenance via telomerase",5.12123592422142e-07,2.731525718364e-05,5.02171415936434,23,0.173913043478261,0.38755338788159,4,"Atm, Cct6a, Pkib, Tcp1","brown","islet",0.173913043478261
"GO:0042608","T cell receptor binding",5.12123592422142e-07,2.731525718364e-05,5.02171415936434,23,0.173913043478261,0.38755338788159,4,"H2-D1, H2-K1, H2-Q1, H2-Q4","brown","islet",0.173913043478261
"GO:0046703","natural killer cell lectin-like receptor binding",5.12123592422142e-07,2.731525718364e-05,5.02171415936434,23,0.173913043478261,0.38755338788159,4,"H2-D1, H2-K1, H2-Q1, H2-Q4","brown","islet",0.173913043478261
"GO:0005802","trans-Golgi network",5.44763974152929e-07,2.89883166152639e-05,5.00983614453638,209,0.0717703349282297,0.258726958989705,15,"Adam10, M6pr, Furin, Stx4a, Tmem165, Tgoln1, Becn1, Yipf5, Vps51, Trappc9, Yipf6, Trappc6b, Plekha3, Scamp1, Ocrl","brown","islet",0.0717703349282297
"GO:0043209","myelin sheath",7.95537130837687e-07,4.21847686957586e-05,4.93645909590269,170,0.0764705882352941,0.266534658125169,13,"Atp5pb, Atp6v1b2, Dld, Gdi2, Gnb5, Mdh1, Prdx1, Stx4a, Tcp1, Uqcrc2, Ndufa10, Rap1a, Dlat","brown","islet",0.0764705882352941
"GO:0006163","purine nucleotide metabolic process",8.18577541528143e-07,4.33560546704731e-05,4.93088538461367,404,0.0569306930693069,0.231997444044522,23,"Adss, Rhoa, Atp5pb, Atp6v1b2, Dld, G6pd2, Galk1, Gnai3, Ldha, Mdh1, Prps1, Rab23, Rora, Nudt5, Gucy1b1, Nampt, Ndufa10, Sdhb, Nudt12, Dnm1l, Mccc2, Gmps, Dlat","brown","islet",0.0569306930693069
"GO:0002483","antigen processing and presentation of endogenous peptide antigen",1.03039505083835e-06,5.43852775963927e-05,4.88574305366335,24,0.166666666666667,0.380693493813441,4,"H2-D1, H2-K1, H2-Q1, H2-Q4","brown","islet",0.166666666666667
"GO:0019885","antigen processing and presentation of endogenous peptide antigen via MHC class I",1.03039505083835e-06,5.43852775963927e-05,4.88574305366335,24,0.166666666666667,0.380693493813441,4,"H2-D1, H2-K1, H2-Q1, H2-Q4","brown","islet",0.166666666666667
"GO:0003924","GTPase activity",1.26060095584357e-06,6.63819347267915e-05,4.84586676700312,239,0.0669456066945607,0.250452282418094,16,"Arf2, Rhoa, Arhgap5, Drg1, Gnai3, Gnal, Rab18, Rab23, Atl2, Atl1, Dnm1l, Trim23, Rab28, Rap1a, Rap1b, Rragb","brown","islet",0.0669456066945607
"GO:0019001","guanyl nucleotide binding",1.29957229244582e-06,6.81976012913674e-05,4.83981931302831,310,0.0612903225806452,0.240249895998736,19,"Adss, Arf2, Rhoa, Arhgap5, Drg1, Gnai3, Gnal, Prps1, Rab18, Rab23, Gucy1b1, Atl2, Atl1, Dnm1l, Trim23, Rab28, Rap1a, Rap1b, Rragb","brown","islet",0.0612903225806452
"GO:0032561","guanyl ribonucleotide binding",1.29957229244582e-06,6.81976012913674e-05,4.83981931302831,310,0.0612903225806452,0.240249895998736,19,"Adss, Arf2, Rhoa, Arhgap5, Drg1, Gnai3, Gnal, Prps1, Rab18, Rab23, Gucy1b1, Atl2, Atl1, Dnm1l, Trim23, Rab28, Rap1a, Rap1b, Rragb","brown","islet",0.0612903225806452
"GO:0016188","synaptic vesicle maturation",1.96101069849242e-06,0.000100703536996989,4.75740131510337,25,0.16,0.374165738677394,4,"Atp6v1b2, Atp6ap1, Atp6v1h, Picalm","brown","islet",0.16
"GO:0042605","peptide antigen binding",1.96101069849242e-06,0.000100703536996989,4.75740131510337,25,0.16,0.374165738677394,4,"H2-D1, H2-K1, H2-Q1, H2-Q4","brown","islet",0.16
"GO:0071782","endoplasmic reticulum tubular network",1.96101069849242e-06,0.000100703536996989,4.75740131510337,25,0.16,0.374165738677394,4,"Rab18, Atl2, Lnpk, Atl1","brown","islet",0.16
"GO:0090148","membrane fission",1.96101069849242e-06,0.000100703536996989,4.75740131510337,25,0.16,0.374165738677394,4,"Sh3gl2, Slc25a46, Chmp2b, Dnm1l","brown","islet",0.16
"GO:0140448","signaling receptor ligand precursor processing",1.96101069849242e-06,0.000100703536996989,4.75740131510337,25,0.16,0.374165738677394,4,"Adam10, Furin, Yipf5, Disp1","brown","islet",0.16
"GO:1904376","negative regulation of protein localization to cell periphery",1.96101069849242e-06,0.000100703536996989,4.75740131510337,25,0.16,0.374165738677394,4,"Lypla1, Tmed2, Lztfl1, Picalm","brown","islet",0.16
"GO:0005525","GTP binding",2.35928390424078e-06,0.000120883444137421,4.71992778142655,293,0.0614334470989761,0.240534492957077,18,"Adss, Arf2, Rhoa, Arhgap5, Drg1, Gnai3, Gnal, Rab18, Rab23, Gucy1b1, Atl2, Atl1, Dnm1l, Trim23, Rab28, Rap1a, Rap1b, Rragb","brown","islet",0.0614334470989761
"GO:0009117","nucleotide metabolic process",2.87212595706521e-06,0.000146829783775893,4.67975880718563,450,0.0533333333333333,0.224947407859916,24,"Adss, Rhoa, Atp5pb, Atp6v1b2, Dld, G6pd2, Galk1, Gnai3, Ldha, Mdh1, Prps1, Rab23, Rora, Nudt5, Gucy1b1, Nampt, Cmpk1, Ndufa10, Sdhb, Nudt12, Dnm1l, Mccc2, Gmps, Dlat","brown","islet",0.0533333333333333
"GO:0140534","endoplasmic reticulum protein-containing complex",2.97025734519174e-06,0.000149675384950027,4.67286588348353,101,0.0891089108910891,0.286321843420655,9,"H2-D1, H2-K1, H2-Q1, H2-Q4, Ufd1, Magt1, Pigc, Pigh, Mmgt1","brown","islet",0.0891089108910891
"GO:0002475","antigen processing and presentation via MHC class Ib",3.55284903674757e-06,0.000159283733881744,4.63595986524205,26,0.153846153846154,0.36794648440312,4,"H2-D1, H2-K1, H2-Q1, H2-Q4","brown","islet",0.153846153846154
"GO:0042288","MHC class I protein binding",3.55284903674757e-06,0.000159283733881744,4.63595986524205,26,0.153846153846154,0.36794648440312,4,"H2-D1, H2-K1, H2-Q1, H2-Q4","brown","islet",0.153846153846154
"GO:0072521","purine-containing compound metabolic process",3.85008882508586e-06,0.000172440064879706,4.61931505364269,428,0.0537383177570093,0.225764476411462,23,"Adss, Rhoa, Atp5pb, Atp6v1b2, Dld, G6pd2, Galk1, Gnai3, Ldha, Mdh1, Prps1, Rab23, Rora, Nudt5, Gucy1b1, Nampt, Ndufa10, Sdhb, Nudt12, Dnm1l, Mccc2, Gmps, Dlat","brown","islet",0.0537383177570093
"GO:0006753","nucleoside phosphate metabolic process",4.07849473171851e-06,0.000182311516221568,4.60734170366761,456,0.0526315789473684,0.223542124777477,24,"Adss, Rhoa, Atp5pb, Atp6v1b2, Dld, G6pd2, Galk1, Gnai3, Ldha, Mdh1, Prps1, Rab23, Rora, Nudt5, Gucy1b1, Nampt, Cmpk1, Ndufa10, Sdhb, Nudt12, Dnm1l, Mccc2, Gmps, Dlat","brown","islet",0.0526315789473684
"GO:0032206","positive regulation of telomere maintenance",4.47808042292053e-06,0.000199977022807873,4.58786220551117,53,0.113207547169811,0.319878423929766,6,"Atm, Cct6a, Pkib, Tcp1, Yy1, Hnrnpa2b1","brown","islet",0.113207547169811
"GO:1901998","toxin transport",4.68699446232179e-06,0.00020910146695275,4.57833152246921,39,0.128205128205128,0.33868842842937,5,"Adam10, Cct6a, Tcp1, Trip4, Rab28","brown","islet",0.128205128205128
"GO:0005777","peroxisome",5.04778654741855e-06,0.000224537770737222,4.56279180013884,123,0.0813008130081301,0.274414307295582,10,"Atm, Mpv17, Prdx1, Pex7, Pex2, Atad1, Nudt12, Pex13, Dnm1l, Mff","brown","islet",0.0813008130081301
"GO:0042579","microbody",5.04778654741855e-06,0.000224537770737222,4.56279180013884,123,0.0813008130081301,0.274414307295582,10,"Atm, Mpv17, Prdx1, Pex7, Pex2, Atad1, Nudt12, Pex13, Dnm1l, Mff","brown","islet",0.0813008130081301
"GO:0048284","organelle fusion",5.08214132244333e-06,0.000225782423361453,4.56136803235655,143,0.0769230769230769,0.267405981290439,11,"Bak1, Gdap1, Gnai3, Stx4a, Yipf5, Chmp2b, Dnm1l, Mff, Trim9, Stx12, Bnip1","brown","islet",0.0769230769230769
"GO:0019883","antigen processing and presentation of endogenous antigen",6.16109174567114e-06,0.000272993899820351,4.52078438128387,27,0.148148148148148,0.362013992898246,4,"H2-D1, H2-K1, H2-Q1, H2-Q4","brown","islet",0.148148148148148
"GO:0019693","ribose phosphate metabolic process",1.02428668362631e-05,0.000445618514223289,4.41198192051225,364,0.0549450549450549,0.228186640665561,20,"Adss, Rhoa, Atp5pb, Atp6v1b2, Dld, G6pd2, Galk1, Gnai3, Prps1, Rab23, Rora, Nudt5, Gucy1b1, Cmpk1, Ndufa10, Sdhb, Dnm1l, Mccc2, Gmps, Dlat","brown","islet",0.0549450549450549
"GO:0008053","mitochondrial fusion",1.02742352015017e-05,0.000445706108027051,4.41131998528359,28,0.142857142857143,0.356348322549899,4,"Bak1, Gdap1, Dnm1l, Mff","brown","islet",0.142857142857143
"GO:0042611","MHC protein complex",1.02742352015017e-05,0.000445706108027051,4.41131998528359,28,0.142857142857143,0.356348322549899,4,"H2-D1, H2-K1, H2-Q1, H2-Q4","brown","islet",0.142857142857143
"GO:0044743","protein transmembrane import into intracellular organelle",1.02742352015017e-05,0.000445706108027051,4.41131998528359,28,0.142857142857143,0.356348322549899,4,"Pex7, Pex2, Usp9x, Pex13","brown","islet",0.142857142857143
"GO:0016462","pyrophosphatase activity",1.35378783630014e-05,0.000583949204010144,4.35122541580909,478,0.0502092050209205,0.218605160276642,24,"Arf2, Rhoa, Arhgap5, Atp5pb, Cct6a, Drg1, Gnai3, Gnal, Rab18, Rab23, Tcp1, Ddx25, Nudt5, Atl2, Atad1, Nudt12, Atl1, Dnm1l, Trim23, Rab28, Rap1a, Rap1b, Gmps, Rragb","brown","islet",0.0502092050209205
"GO:0019674","NAD metabolic process",1.65424648856938e-05,0.000712201583689368,4.30707885612408,29,0.137931034482759,0.350931203171798,4,"Ldha, Mdh1, Nampt, Nudt12","brown","islet",0.137931034482759
"GO:0006486","protein glycosylation",1.80637933904215e-05,0.000775500272322055,4.28757050214824,175,0.0685714285714286,0.253449113634217,12,"Galnt1, Gcnt2, Mgat1, Tmem165, B3galt2, B3gnt2, Pmm2, Magt1, Lmf1, Golga2, B3galt6, Dpy19l4","brown","islet",0.0685714285714286
"GO:0043413","macromolecule glycosylation",1.80637933904215e-05,0.000775500272322055,4.28757050214824,175,0.0685714285714286,0.253449113634217,12,"Galnt1, Gcnt2, Mgat1, Tmem165, B3galt2, B3gnt2, Pmm2, Magt1, Lmf1, Golga2, B3galt6, Dpy19l4","brown","islet",0.0685714285714286
"GO:0045335","phagocytic vesicle",2.23771152514374e-05,0.000956170356194158,4.23974769829836,94,0.0851063829787234,0.280536140622521,8,"H2-D1, H2-K1, Rab23, Stx4a, Stxbp3, Becn1, Stx12, Rap1a","brown","islet",0.0851063829787234
"GO:0005801","cis-Golgi network",2.30899754940506e-05,0.000985706076620434,4.23270259446463,59,0.101694915254237,0.304841126187198,6,"H2-D1, H2-K1, H2-Q1, Yipf6, Trappc6b, Golga2","brown","islet",0.101694915254237
"GO:1905476","negative regulation of protein localization to membrane",2.58062803937253e-05,0.0010975500204801,4.20763012653293,30,0.133333333333333,0.34574590364176,4,"Lypla1, Tmed2, Lztfl1, Picalm","brown","islet",0.133333333333333
"GO:1904356","regulation of telomere maintenance via telomere lengthening",2.68422046130201e-05,0.00114054330235361,4.19872501148551,44,0.113636363636364,0.32103822064055,5,"Atm, Cct6a, Pkib, Tcp1, Hnrnpa2b1","brown","islet",0.113636363636364
"GO:0002474","antigen processing and presentation of peptide antigen via MHC class I",3.91242183577223e-05,0.00164705004269339,4.11259158281535,31,0.129032258064516,0.340777100548239,4,"H2-D1, H2-K1, H2-Q1, H2-Q4","brown","islet",0.129032258064516
"GO:0045920","negative regulation of exocytosis",3.91242183577223e-05,0.00164705004269339,4.11259158281535,31,0.129032258064516,0.340777100548239,4,"Stxbp3, Trim9, Rap1a, Rap1b","brown","islet",0.129032258064516
"GO:0061631","ubiquitin conjugating enzyme activity",3.91242183577223e-05,0.00164705004269339,4.11259158281535,31,0.129032258064516,0.340777100548239,4,"Ube2d3, Ube2r2, Ube2d2b, Ube2q2","brown","islet",0.129032258064516
"GO:0030135","coated vesicle",4.33063416760415e-05,0.00181639398097946,4.08909288966239,161,0.0683229813664596,0.253086536645188,11,"Furin, Tgoln1, Tmed2, Tmed7, Yipf5, Yipf6, Golga2, Scamp1, Bnip1, Picalm, Ocrl","brown","islet",0.0683229813664596
"GO:0046496","nicotinamide nucleotide metabolic process",4.64876614323373e-05,0.00194445636202292,4.07261786646754,62,0.0967741935483871,0.298063554635246,6,"G6pd2, Ldha, Mdh1, Prps1, Nampt, Nudt12","brown","islet",0.0967741935483871
"GO:0030134","COPII-coated ER to Golgi transport vesicle",4.84970656322581e-05,0.00202664343077923,4.0627543141438,46,0.108695652173913,0.314696387689978,5,"Tmed2, Tmed7, Yipf5, Yipf6, Golga2","brown","islet",0.108695652173913
"GO:0030672","synaptic vesicle membrane",4.88734756600717e-05,0.00203863261567424,4.06094982261001,119,0.0756302521008403,0.26552359100867,9,"Atp6v1b2, Sypl, Sh3gl2, Atp6ap1, Dnm1l, Mff, Stx12, Scamp1, Atp6v1h","brown","islet",0.0756302521008403
"GO:0099501","exocytic vesicle membrane",4.88734756600717e-05,0.00203863261567424,4.06094982261001,119,0.0756302521008403,0.26552359100867,9,"Atp6v1b2, Sypl, Sh3gl2, Atp6ap1, Dnm1l, Mff, Stx12, Scamp1, Atp6v1h","brown","islet",0.0756302521008403
"GO:0006888","endoplasmic reticulum to Golgi vesicle-mediated transport",4.97202437987898e-05,0.00207016188760044,4.05693814121186,99,0.0808080808080808,0.273927134537773,8,"Tmed2, Tmed7, Yipf5, Lmf1, Trappc9, Yipf6, Trappc6b, Golga2","brown","islet",0.0808080808080808
"GO:0051225","spindle assembly",4.97202437987898e-05,0.00207016188760044,4.05693814121186,99,0.0808080808080808,0.273927134537773,8,"Rhoa, Drg1, Stag2, Bccip, Chmp2b, Haus7, Mzt1, Golga2","brown","islet",0.0808080808080808
"GO:0001916","positive regulation of T cell mediated cytotoxicity",5.77985626073474e-05,0.00239993120033243,4.02162279880984,32,0.125,0.336010752516124,4,"H2-D1, H2-K1, H2-Q1, H2-Q4","brown","islet",0.125
"GO:0065002","intracellular protein transmembrane transport",6.39628254235358e-05,0.00265105250049323,3.99769303053248,47,0.106382978723404,0.311660528333906,5,"Pex7, Pex2, Usp9x, Sec62, Pex13","brown","islet",0.106382978723404
"GO:0000070","mitotic sister chromatid segregation",6.51997210177058e-05,0.00269986117486954,3.9931557134712,165,0.0666666666666667,0.250203169476848,11,"Rhoa, Atm, Drg1, Stag2, Becn1, Bccip, Nsmce2, Chmp2b, Mzt1, Golga2, Psmg2","brown","islet",0.0666666666666667
"GO:0019362","pyridine nucleotide metabolic process",7.1434127764336e-05,0.00295265382909755,3.97145789366647,64,0.09375,0.293784825696502,6,"G6pd2, Ldha, Mdh1, Prps1, Nampt, Nudt12","brown","islet",0.09375
"GO:0046390","ribose phosphate biosynthetic process",7.19855317199425e-05,0.00297274793276825,3.96962600391321,166,0.0662650602409639,0.249497486929099,11,"Adss, Atp5pb, Dld, G6pd2, Prps1, Gucy1b1, Cmpk1, Ndufa10, Sdhb, Gmps, Dlat","brown","islet",0.0662650602409639
"GO:0099003","vesicle-mediated transport in synapse",7.22751013784162e-05,0.00298200259763302,3.96866929619528,238,0.0588235294117647,0.235789996211097,14,"Atp6v1b2, Sh3gl2, Stx4a, Atp6ap1, Atad1, Usp46, Scrn1, Dnm1l, Mff, Trim9, Atp6v1h, Rap1a, Rap1b, Picalm","brown","islet",0.0588235294117647
"GO:0006605","protein targeting",7.78950236655085e-05,0.00321096681263702,3.95078578022656,239,0.0585774058577406,0.235324881080236,14,"Gdap1, M6pr, Pex7, Prnp, Pex2, Usp9x, Ywhae, Ppp1r3c, Becn1, Golga7, Vps51, Sec62, Pex13, Mff","brown","islet",0.0585774058577406
